{
  "schemaVersion": "1",
  "models": [
    {
      "id": "claude-fable-5",
      "capabilities": {
        "vendor": "anthropic",
        "class": "frontier",
        "strengths": [
          "frontier reasoning",
          "long-horizon agentic work",
          "code review",
          "architecture"
        ],
        "weaknesses": [
          "highest cost",
          "slower",
          "minutes-long turns on hard tasks",
          "OpenRouter dependency"
        ],
        "releasedAt": "2026-06-10",
        "qualityScores": {
          "routing": 62,
          "planning": 99,
          "coding": 95,
          "review": 98,
          "classify": 62
        },
        "pricing": {
          "inputCostPerMTok": 10,
          "outputCostPerMTok": 50,
          "cacheWriteCostPerMTok": 12.5,
          "cacheReadCostPerMTok": 1
        },
        "contextWindowTokens": 1000000,
        "toolSupport": "full",
        "multimodal": {
          "text": true,
          "image": true
        },
        "latencyTier": "slow",
        "reasoningTier": "advanced",
        "costPerMillionInputTokensUsd": 10,
        "costPerMillionOutputTokensUsd": 50,
        "agent": "claude"
      }
    },
    {
      "id": "claude-opus-4-8",
      "capabilities": {
        "vendor": "anthropic",
        "class": "frontier",
        "strengths": [
          "long-horizon reasoning",
          "code review",
          "architecture",
          "agentic coding"
        ],
        "weaknesses": [
          "higher cost",
          "slower"
        ],
        "releasedAt": "2026-05-20",
        "qualityScores": {
          "routing": 62,
          "planning": 97,
          "coding": 88,
          "review": 96,
          "classify": 62
        },
        "pricing": {
          "inputCostPerMTok": 5,
          "outputCostPerMTok": 25,
          "cacheWriteCostPerMTok": 6.25,
          "cacheReadCostPerMTok": 0.5
        },
        "contextWindowTokens": 1000000,
        "toolSupport": "full",
        "multimodal": {
          "text": true,
          "image": true
        },
        "latencyTier": "slow",
        "reasoningTier": "advanced",
        "costPerMillionInputTokensUsd": 5,
        "costPerMillionOutputTokensUsd": 25
      }
    },
    {
      "id": "claude-opus-4-7",
      "capabilities": {
        "vendor": "anthropic",
        "class": "frontier",
        "strengths": [
          "long-horizon reasoning",
          "code review",
          "architecture"
        ],
        "weaknesses": [
          "higher cost",
          "slower"
        ],
        "qualityScores": {
          "routing": 60,
          "planning": 95,
          "coding": 85,
          "review": 95,
          "classify": 60
        },
        "pricing": {
          "inputCostPerMTok": 5,
          "outputCostPerMTok": 25,
          "cacheWriteCostPerMTok": 6.25,
          "cacheReadCostPerMTok": 0.5
        },
        "contextWindowTokens": 200000,
        "toolSupport": "full",
        "multimodal": {
          "text": true,
          "image": true
        },
        "latencyTier": "slow",
        "reasoningTier": "advanced",
        "costPerMillionInputTokensUsd": 5,
        "costPerMillionOutputTokensUsd": 25
      }
    },
    {
      "id": "claude-opus-4-6",
      "capabilities": {
        "vendor": "anthropic",
        "class": "frontier",
        "strengths": [
          "long-horizon reasoning",
          "code review",
          "architecture"
        ],
        "weaknesses": [
          "higher cost",
          "slower"
        ],
        "qualityScores": {
          "routing": 58,
          "planning": 92,
          "coding": 82,
          "review": 92,
          "classify": 58
        },
        "pricing": {
          "inputCostPerMTok": 5,
          "outputCostPerMTok": 25,
          "cacheWriteCostPerMTok": 6.25,
          "cacheReadCostPerMTok": 0.5
        },
        "contextWindowTokens": 200000,
        "toolSupport": "full",
        "multimodal": {
          "text": true,
          "image": true
        },
        "latencyTier": "slow",
        "reasoningTier": "advanced",
        "costPerMillionInputTokensUsd": 5,
        "costPerMillionOutputTokensUsd": 25
      }
    },
    {
      "id": "claude-sonnet-5",
      "capabilities": {
        "vendor": "anthropic",
        "class": "strong_generalist",
        "strengths": [
          "code generation",
          "balanced quality/cost",
          "instruction following"
        ],
        "weaknesses": [
          "less deep reasoning"
        ],
        "releasedAt": "2026-06-30",
        "qualityScores": {
          "routing": 77,
          "planning": 84,
          "coding": 92,
          "review": 84,
          "classify": 80
        },
        "pricing": {
          "inputCostPerMTok": 2,
          "outputCostPerMTok": 10,
          "cacheWriteCostPerMTok": 2.5,
          "cacheReadCostPerMTok": 0.2
        },
        "contextWindowTokens": 1000000,
        "toolSupport": "full",
        "multimodal": {
          "text": true,
          "image": true
        },
        "latencyTier": "standard",
        "reasoningTier": "standard",
        "costPerMillionInputTokensUsd": 2,
        "costPerMillionOutputTokensUsd": 10
      }
    },
    {
      "id": "claude-sonnet-4-6",
      "capabilities": {
        "vendor": "anthropic",
        "class": "strong_generalist",
        "strengths": [
          "code generation",
          "balanced quality/cost",
          "instruction following"
        ],
        "weaknesses": [
          "less deep reasoning"
        ],
        "qualityScores": {
          "routing": 75,
          "planning": 82,
          "coding": 90,
          "review": 82,
          "classify": 78
        },
        "pricing": {
          "inputCostPerMTok": 3,
          "outputCostPerMTok": 15,
          "cacheWriteCostPerMTok": 3.75,
          "cacheReadCostPerMTok": 0.3
        },
        "contextWindowTokens": 200000,
        "toolSupport": "full",
        "multimodal": {
          "text": true,
          "image": true
        },
        "latencyTier": "standard",
        "reasoningTier": "standard",
        "costPerMillionInputTokensUsd": 3,
        "costPerMillionOutputTokensUsd": 15
      }
    },
    {
      "id": "claude-sonnet-4-5-20250929",
      "capabilities": {
        "vendor": "anthropic",
        "class": "strong_generalist",
        "strengths": [
          "code generation",
          "balanced quality/cost",
          "instruction following"
        ],
        "weaknesses": [
          "less deep reasoning"
        ],
        "qualityScores": {
          "routing": 72,
          "planning": 78,
          "coding": 86,
          "review": 78,
          "classify": 74
        },
        "pricing": {
          "inputCostPerMTok": 3,
          "outputCostPerMTok": 15,
          "cacheWriteCostPerMTok": 3.75,
          "cacheReadCostPerMTok": 0.3
        },
        "contextWindowTokens": 200000,
        "toolSupport": "full",
        "multimodal": {
          "text": true,
          "image": true
        },
        "latencyTier": "standard",
        "reasoningTier": "standard",
        "costPerMillionInputTokensUsd": 3,
        "costPerMillionOutputTokensUsd": 15
      }
    },
    {
      "id": "claude-haiku-4-5-20251001",
      "capabilities": {
        "vendor": "anthropic",
        "class": "fast_economy",
        "strengths": [
          "speed",
          "low cost",
          "classification"
        ],
        "weaknesses": [
          "less depth on complex reasoning"
        ],
        "qualityScores": {
          "routing": 88,
          "planning": 55,
          "coding": 60,
          "review": 55,
          "classify": 92
        },
        "pricing": {
          "inputCostPerMTok": 0.8,
          "outputCostPerMTok": 4,
          "cacheWriteCostPerMTok": 1,
          "cacheReadCostPerMTok": 0.08
        },
        "contextWindowTokens": 200000,
        "toolSupport": "full",
        "multimodal": {
          "text": true,
          "image": true
        },
        "latencyTier": "fast",
        "reasoningTier": "basic",
        "costPerMillionInputTokensUsd": 0.8,
        "costPerMillionOutputTokensUsd": 4
      }
    },
    {
      "id": "claude-haiku-4-5",
      "capabilities": {
        "vendor": "anthropic",
        "class": "fast_economy",
        "strengths": [
          "speed",
          "low cost",
          "classification"
        ],
        "weaknesses": [
          "less depth on complex reasoning"
        ],
        "qualityScores": {
          "routing": 88,
          "planning": 55,
          "coding": 60,
          "review": 55,
          "classify": 92
        },
        "pricing": {
          "inputCostPerMTok": 0.8,
          "outputCostPerMTok": 4,
          "cacheWriteCostPerMTok": 1,
          "cacheReadCostPerMTok": 0.08
        },
        "defaultLadderEligible": false,
        "contextWindowTokens": 200000,
        "toolSupport": "full",
        "multimodal": {
          "text": true,
          "image": true
        },
        "latencyTier": "fast",
        "reasoningTier": "basic",
        "costPerMillionInputTokensUsd": 0.8,
        "costPerMillionOutputTokensUsd": 4,
        "agent": "claude",
        "supportedModel": {
          "wavemillAlias": "claude-haiku-4-5",
          "providerNativeId": "claude-haiku-4-5-20251001",
          "stages": [
            "coding",
            "review"
          ],
          "lifecycle": "supported",
          "launchEligible": true,
          "routingEligible": true
        }
      }
    },
    {
      "id": "gpt-5.5",
      "capabilities": {
        "vendor": "openai",
        "class": "frontier",
        "strengths": [
          "frontier reasoning",
          "code generation",
          "architecture"
        ],
        "weaknesses": [
          "higher cost"
        ],
        "releasedAt": "2026-05-01",
        "qualityScores": {
          "routing": 62,